{"schema_version":1,"task_id":"7f1c2a9e-3b4d-4e5f-8a6b-1c2d3e4f5a6b","source":{"kind":"github_issue","ref":"acme/web#42","url":"https://github.com/acme/web/issues/42"},"origin_trust":"trusted","privacy_class":"internal","repository":{"remote":"acme/web","base_ref":"main"},"title":"Document MetricCard props","description":"Add JSDoc to MetricCard.","task_class":"docs","requirements":["Every exported prop documented"],"acceptance_criteria":["pnpm lint passes"],"created_at":"2026-09-29T20:00:00Z"}
