{"schema_version":1,"task_id":"7f1c2a9e-3b4d-4e5f-8a6b-1c2d3e4f5a6b","source":{"kind":"gmail","ref":"thread-18f2"},"origin_trust":"untrusted","privacy_class":"confidential","repository":{"remote":"acme/web","base_ref":"main"},"title":"Customer reports broken export","description":"","task_class":"unknown","requirements":[],"acceptance_criteria":[],"created_at":"2026-09-29T20:00:00Z"}
